{
  "id": "res_0123456789abcdef0123456789abcdef",
  "kind": "file",
  "mime_type": "application/pdf",
  "size_bytes": 1024,
  "sha256": "0123456789abcdef0123456789abcdef0123456789abcdef0123456789abcdef",
  "metadata": {},
  "source": "multipart",
  "state": "ready",
  "retention": "ephemeral",
  "created_at": "2026-07-21T11:00:00Z",
  "updated_at": "2026-07-21T11:00:01Z",
  "expires_at": "2026-07-22T11:00:00Z",
  "revision": 2
}
